笔记标题,笔记链接,用户ID,用户名,头像链接,IP属地,笔记发布时间,笔记收藏数量,笔记评论数量,笔记点赞数量,笔记转发数量,笔记内容
迄今去过最舒服的江南古镇，人少美好,https://www.xiaohongshu.com/explore/67f47a37000000001c00fe1a?xsec_token=ABUJa1C-dn5Q7aJCW0p_pUUCWkZNJThmoRIqTYQ-3EjA4=&xsec_source=pc_feed,55059a034fac633dfa86ea01,小晏哥,https://sns-avatar-qc.xhscdn.com/avatar/62ff1f29da4d69c619c68b2f.jpg,浙江,2025.04.08,3260,220,2864,889,我是裸辞旅行的小晏哥，逛了很多江浙沪古镇，在苏州找到了一个本地人都很少知道的地方——「震泽古镇」。	震泽古镇游客极少，免费无门票，却有近千年的历史，被称为“丝绸之镇”，有着两处值得观赏的全国文保：师俭堂和慈云禅寺。	我一个人沿河漫步半天，在没有人挤人的江南水乡闲逛，就很舒服🎐	🚗 如何去震泽古镇震泽古镇位于📍苏州吴江区，古镇免费开放，部分景点需要小门票。自驾直接导航「震泽古镇」，公交可以乘坐苏州7501路到「师俭堂站」。	🚶 必逛景点推荐1️⃣ 慈云禅寺始建于宋朝的古寺，也是全国重点文物宝物单位。六面五层高的慈云寺塔是震泽古镇的地标，还有明清壁画遗留，很值得观赏。	2️⃣ 师俭堂典型的江南大宅，建于清朝，里面的「锄经园」，被称为“国内最袖珍的江南园林”，小而立体，极美❗️	3️⃣ 禹迹桥与慈云寺相邻的清朝拱桥，可以拍拱桥倒影。	4️⃣ 宝塔街沿街很多茶店、小吃，非常有烟火气🍵	震泽古镇不大，都是当地人在里面生活，可以安排半天时间慢逛，坐在河边喝茶小憩（茶店都不贵），就很惬意。	#苏州[话题]# #苏州旅游[话题]# #苏州旅行[话题]# #苏州旅游攻略[话题]# #苏州旅行攻略[话题]# #江浙沪旅游[话题]# #江浙沪周边游[话题]# #震泽古镇[话题]# #江苏旅游[话题]# #江南[话题]# #春天就要上春山[话题]# #花情实况播报[话题]# #春景里的中式浪漫[话题]# #跟着兴趣去旅行[话题]# #我是兴趣小导游[话题]# #先出发再说[话题]# #行走中的建筑学[话题]# #我是快乐行动派[话题]#
比起周庄乌镇，我更爱震泽老街,https://www.xiaohongshu.com/explore/66b0a31900000000050208a4?xsec_token=ABq5-ar-WKGF_8sKhCuJQaTvauqyaNcpRcpjqN-PNmgPA=&xsec_source=pc_feed,61ecb3d40000000021022b18,跳跳日记本,https://sns-avatar-qc.xhscdn.com/avatar/1040g2jo30nbu6jav6g605ofcmfa8caoob4hbcmo,未知,2024.08.05,32,12,41,55,相比其他古镇的热闹，上午八点的震泽老街格外“清冷”。倒也不是古镇风光不够好，实在是周庄同里乌镇南浔的名气太响了吧[笑哭R]震泽老街不算大，却很有特点：1⃣️慈云禅寺，全国重点文物保护单位，相传是三国时期孙夫人的望夫塔。2⃣️禹迹桥，老街水路的制高点，登高可以俯瞰老街、远眺文昌阁和頔塘桥。3⃣️仁里坊，可以拍到宝塔、老街、弄堂、三轮车的经典机位，周边的师俭堂和四碗茶楼很有名。4⃣️老街茶楼，沿河的宝塔街和南横街都是茶馆，天气凉快的时候本地人最爱去，一盏熏豆绿茶加一碟零食是标配。#苏式建筑[话题]# #最美古镇攻略[话题]# #江南[话题]# #古镇[话题]# #家乡的味道[话题]# #富士直出[话题]#
震泽·师俭堂 | 🌿庭院深深昼景长🌿,https://www.xiaohongshu.com/explore/6678e3a4000000001c0252e3?xsec_token=ABLhBgjMoohiXPjkpDISOF6jTqBrtuWljwXHwm386aTPk=&xsec_source=pc_feed,55963564b7ba22563be28d4d,雨晴烟晚,https://sns-avatar-qc.xhscdn.com/avatar/608186c0b2d76627fe53d57e.jpg,未知,2024.06.24,58,16,147,61,师俭堂，始建于清朝嘉庆六年。它以宝塔街为界，分南北两部分，是集河埠、行栈、商铺、街道、厅堂、内宅、花园、下房等于一体的江南民居古建筑群。	堂内有处花园名为“锄经园”，占地仅有半亩，其间沿壁回廊，假山半亭，花卉树木均布局巧妙～	📷：索尼7CM2	🌿🌿🌿🌿	我是雨晴烟晚，一位喜欢花花草草，喜欢猫猫狗狗的摄影爱好者。不定时分享苏州、园林美景、小动物等，原图可🧣（雨晴烟晚85）自取～	照片均为原创，创作不易，禁止二改、商用等，转载请@本人，感谢支持	| 苏州旅行 | 苏州攻略 | 苏州拍照 | 每日打卡 || 记录生活 | 日常碎片 | 夏日赏花 | 每日壁纸 || 摄影日常 | 周末去哪儿 | 周末好去处 |	#名为夏天的绿色[话题]# #摄影日常[话题]# #我拍到的治愈画面[话题]# #苏州园林[话题]# #苏州拍照[话题]# #苏州旅行[话题]# #笔记灵感[话题]# #浪漫生活的记录者[话题]# #震泽古镇[话题]# #电影感[话题]#
,https://www.xiaohongshu.com/explore/672d63ba000000003c0147ef?xsec_token=ABu8SCnBx9tDVpaigr9U9VOy19RAS8DXIpoVFa0L7xcEk=&xsec_source=pc_feed,574bff015e87e7609f5ad415,如梦苏州,https://sns-avatar-qc.xhscdn.com/avatar/66038c0618874b056e2532ca.jpg,未知,2024.11.08,910,12,844,400,人少景美的千年古镇，不收门票停车还免费。#苏州[话题]# #苏州旅游攻略[话题]# #周末去哪玩[话题]# #震泽古镇[话题]#
,https://www.xiaohongshu.com/explore/665ee85e000000001303f039?xsec_token=AB0JMwYFBhKcyl0Qq43Q9aMw_zDjzw2E-IRjVtiFmdbqE=&xsec_source=pc_feed,65734d8d000000001c019fd7,中国旅游,https://sns-avatar-qc.xhscdn.com/avatar/1040g2jo31552u69c1c005pbj9m6n37unfj9h8q0,未知,2024.06.04,59,8,55,138,震泽古镇 一个被人遗忘的江南小镇#旅游[话题]# #旅行大玩家[话题]# #旅行[话题]#
迄今为止❗️我最喜欢的古镇出现了❗️还是免费,https://www.xiaohongshu.com/explore/66754f72000000001c020a84?xsec_token=ABlkMGXMJHTXB1381GB3RZcD0ft_c3nhLN9ZTdx8FTjic=&xsec_source=pc_feed,5de26dd70000000001008cd4,王先生,https://sns-avatar-qc.xhscdn.com/avatar/640fc0df791182156abdfa9f.jpg,未知,2024.06.21,1716,195,1660,866,震泽古镇🏞️一个被夏日阳光☀️眷顾的江南秘境🏡在这里🌿古朴的青石板路仿佛会讲故事📕古老的建筑群像🏯是在诉说着千年的过往走在这座冷门的苏州古镇🏞️你会发现这里的每一块砖瓦都有自己的历史📜每一个角落都有属于自己的故事🍀-🎫景区门票：古镇免费开放，古镇内部分景点需小门票📍地址：苏州市吴江区震泽镇宝塔街12号。🚗交通攻略：乘坐苏州公交781路至石墩浜桥站，或乘坐7501（7502）路至师俭堂-💡【不可错过的震泽三绝】1️⃣ 慈云寺塔&禹迹桥：两者的相互辉映，是震泽的灵魂所在，也是摄影爱好者的天堂📸。2️⃣ 师俭堂：这个百年老宅保存完好，一步一景，每个角落都散发着浓厚的历史韵味。3️⃣ 宝塔街：这里汇集了各种当地特色小吃，让你在品味传统美食的同时，也能感受到浓浓的烟火气🔥-🍰【美食推荐】来到震泽，别忘了尝试一下当地的特色小吃。海棠糕、定胜糕、萝卜丝饼……这些看似简单的食物，却藏着让人回味无穷的味道。-PS：如果逛完古镇，也可以去旁边的柴米多农场，体验农耕文化的乐趣，也🉑以坐在在田边的柴米多咖啡馆欣赏远离城市喧嚣的田园风光-@薯队长 @薯条小助手 @生活薯 @摄影薯 @日常薯 @城市情报官 @走走薯 @本地薯#漫游吴江[话题]# #吴江photowalk[话题]# #东太湖种草计划[话题]##519中国旅游日[话题]##乐游吴江Chill一夏[话题]##吴江[话题]##苏州打卡[话题]# #苏州旅行[话题]# #苏州[话题]# #苏州旅游攻略[话题]# #苏州探店[话题]#  #旅游攻略[话题]# #笔记灵感[话题]# #江南[话题]# #周末去哪儿[话题]# #江浙沪[话题]# #江浙沪亲子游[话题]# #江浙沪旅游[话题]# #江浙沪周边游[话题]##江浙沪小众周边游[话题]# #浪漫生活的记录者[话题]##假日citywalk[话题]#  #苏州citywalk[话题]##园林景观[话题]# #苏州园林[话题]##小红书影像发现计划[话题]##我的私藏旅行路线[话题]##震泽古镇[话题]# #震泽[话题]# #苏州古镇[话题]# #苏州旅游攻略[话题]#
震泽｜被茶香🍵包裹的苏州古镇【附攻略】,https://www.xiaohongshu.com/explore/67a0cafb000000001800a3d0?xsec_token=ABwOcQc90x4bKCbMdlZn8YEQz0DzPUXF3xBioB-fF7mAk=&xsec_source=pc_feed,5c5eb91f000000001a00c4ae,🌈好彩妹🎀,https://sns-avatar-qc.xhscdn.com/avatar/1040g2jo3165bfr17gu0g5n2un4fmhh5eec0ojeo,未知,2025.02.03,18,1,27,15,🎫：AAAA景区，门票免费🆓🚗：自驾导航宝塔街停车场🅿️免费🆓停车	古镇不大，纯逛的话一个多小时。特色是🈶很多的茶楼，价格实惠，临河喝茶🍵非常惬意～推荐这个卤菜馆，听评弹吃卤菜，缺点是人太多了🤣小吃的话，比较多的就是糕点，还有绕绕糖，童年的回忆～ 人均五十能够吃饱喝足啦！	#震泽古镇[话题]# #震泽[话题]# #苏州[话题]#  #苏州旅游[话题]#  #美食推荐[话题]#   #古镇[话题]#   #自驾游[话题]#   #最美古镇攻略[话题]#   #苏州旅游攻略[话题]#   #苏州古镇[话题]#   #苏州古镇打卡[话题]#   #江南[话题]#   #苏州旅行推荐[话题]#   #苏州周边游[话题]#   #江浙沪周边游[话题]#   #苏州亲子游[话题]#   #周末去哪玩[话题]#   #苏州周末好去处[话题]#   #苏州旅游美食攻略[话题]#
苏州小西天🤎远不及亲眼所见万分之一的震撼,https://www.xiaohongshu.com/explore/67ab440a000000002903ea07?xsec_token=ABvb1_y6s9P3kdVnU1d3H6pM1IZ89Qbk7F73m9m__yEwA=&xsec_source=pc_feed,580c3bab50c4b43912a8c5a0,苏梨,https://sns-avatar-qc.xhscdn.com/avatar/1040g2jo3135303h4080048q0t9tqnhd0de0moog,未知,2025.02.11,926,201,1736,428,去了好几次木渎古镇，总和明月古寺擦肩而过。而在这座低调的千年古刹里，却有着苏州人自己的“小西天”🤟🏻	周末走进这里，一整个被震撼住了😲天王殿里巨龙昂扬盘飞，天王怒目而视脚踩小gui，大雄宝殿里三大面墙的五百罗汉姿态各异，活灵活现，真的太太太太震撼了‼️	现在还是泥塑阶段，不敢想象等到彩绘完成后，会有多惊艳😍	和我妹在里面慢慢地逛了一个多小时，找到了熟悉的玄奘、活佛济公、哪吒，还有腿巨巨巨长的罗汉、三头六臂的泥塑🫡、吹拉弹唱掏耳朵搓澡的罗汉🤣、肚子上有只🐷型脸的天王，而且从不同角度看天王有不同的感觉，某个角度对视上感觉他们好像活了，真的好有意思啊	如果你周末想反向找个人少又有意思的地方，那一定要来这里，慢慢逛逛看看哦～	📍苏州木渎古镇明月古寺（门票🆓）💡下午1-3点去，光照斜在龙身上超有感觉🎏附近景点：虹饮山房、严家花园、古松园、灵岩山	#古建筑之美[话题]# #古建筑拍照[话题]# #苏州旅行[话题]# #苏州周末去哪儿[话题]# #中式美学[话题]# #老祖宗的审美[话题]# #新年旅行第一站[话题]# #反向旅行出门溜溜[话题]# #chinatravel[话题]# #薯光伴你迎新春[话题]# @生活薯
比起平江路，更偏爱这个免费的悠闲古镇❗️,https://www.xiaohongshu.com/explore/67b33bb9000000001801ad05?xsec_token=ABCtzFO3Ksf9n8aPojJu6hfFUsEDQj8gin1CA0UjlOjK0=&xsec_source=pc_feed,542fd6afd6e4a94165c4533f,橘子妈妈在苏州,https://sns-avatar-qc.xhscdn.com/avatar/661eccb60053fef86f87d6d2.jpg,未知,2025.02.17,51,9,59,72,🌈震泽古镇真的是个很低调的古镇，人少而且很惬意。个人很喜欢这种人少安静的古镇，小朋友可以肆意奔跑玩耍～在这里，你可以看到好多人在湖边茶馆，点上一壶茶跟亲朋好友聊聊天晒晒太阳，待到傍晚再赏个落日，慢慢悠悠得回家去了～	📍苏州市吴江区震泽古镇🎫门票：免费🆓，部分景点需收费⏰开放时间：全天开放▪️师俭堂8:45-16:30，文昌阁8:00-17:00🅿️停车场：宝塔街停车场，免费	🔶游玩景点这里拥有着二千多年历史，是蚕丝之乡，但是这里却极为低调，保留着原生态，人少很安静，特别适合跟朋友家人坐在湖边茶馆，喝杯茶聊聊天度过一个悠闲周末时光。	🔸景点打卡：宝塔街、师俭堂、慈云寺塔、禹迹桥 、文昌阁	🔸美食✔️阿婆圆子：萝卜丝团子✔️老字号仁昌顺：桂花糕、定胜糕✔️铜锣鸡腿鸡腿🍗，腌制入味的鸡腿炸得焦香酥脆，肉质鲜嫩多汁；萝卜丝饼也可以尝尝✔️四碗茶：💰38/套，分别是待帝茶、水铺鸡蛋、熏豆茶和绿茶，非常有特色，店家还赠送瓜子、花生、果条干。	🔸贴心tips：✅古镇多为石板路，不适合推推车✅拍照建议：清晨傍晚适合拍照✅附近游玩：太湖雪蚕桑文化园	@薯队长@薯队长@薯条小助手@薯条小助手@生活薯@生活薯@摄影薯  @日常薯@日常薯@城市情报官  @走走薯@走走薯@本地薯#不早起旅行日记[话题]##古镇[话题]# #震泽古镇[话题]# #最美古镇攻略[话题]# #周末去哪儿[话题]##江浙沪遛娃[话题]# #江浙沪旅游[话题]# #周末遛娃[话题]# #旅游攻略[话题]##新年旅行第一站[话题]# #江浙沪亲子游[话题]# #震泽[话题]#   #苏州古镇[话题]#   #苏州旅游攻略[话题]#
苏州拍照打卡攻略小合集～（tips）,https://www.xiaohongshu.com/explore/67d567e0000000001d014c7b?xsec_token=AByNL9lR8l_y6-Lb8K-gF0Ln9DahL5vLJjC6Vcca97jLQ=&xsec_source=pc_feed,5485c3fd2e1d9372710bb9f0,Wabi-Xabi～,https://sns-avatar-qc.xhscdn.com/avatar/645f342c7c7d626e264e0065.jpg,未知,2025.03.15,37,10,51,11,"如画般的婉约苏州～	如果你喜欢江南水乡的宁静古朴，苏州一定不会让你失望～	but, 苏州除了园林就是古镇，基本没啥山山水水的自然景观[笑哭R]	P2：震泽古镇，位于吴江区，一点点大，出片的就是慈云禅寺这一块。P3：山塘街白居易码头，这个位置朝西，适合日落时候拍，如果有火烧云就更好了。P4：垂虹桥遗址，有2段，免费的小公园，周边很多特色美食饭店，图中这一段适合日落，断桥另一头适合日出。P5：退思园，位于同里古镇，避开苏州市内知名园林人流的好去处，精致小巧，该有的都有，非常出片的小园子。P6：同里积善堂，避开人流的好地方。P7：阳澄湖天主教堂，经典日落打卡机位。P8：石湖的天镜阁，LKS相机漂流带火的地方，推荐傍晚亮灯去拍。P9：东太湖阅湖台，也是日落拍照的好地方，有无人机的话可以俯瞰整个东太湖苏州湾。P10：金鸡湖周围一圈都是拍照的好地方，天气好都很出片～	#江南烟雨美如画[话题]# #苏州旅游[话题]# #苏州打卡[话题]# #苏州拍照[话题]# #江南水乡[话题]#  #水乡古镇[话题]# #同里[话题]# #震泽[话题]# #退思园[话题]# #金鸡湖[话题]#"
震泽古镇真的太牛了,https://www.xiaohongshu.com/explore/673f1259000000000702b185?xsec_token=ABAIoFREq57DS5PUKntxoIUrYYHD0YsvXp2NAEP1RwvkY=&xsec_source=pc_feed,6095cd1e0000000001007ef9,景晨是苏州导游,https://sns-avatar-qc.xhscdn.com/avatar/6095cd1e0000000001007ef9.jpg,未知,2024.11.21,46,5,74,46,
大家千万别去黎里古镇…我怕…,https://www.xiaohongshu.com/explore/67a04cc3000000002900ca29?xsec_token=ABwOcQc90x4bKCbMdlZn8YEUTaBCFTUX73bbnTEY_PIes=&xsec_source=pc_feed,5b17e6bf4eacab2e1cc451ad,薄凉之客,https://sns-avatar-qc.xhscdn.com/avatar/1040g2jo31eh4kgpp0u6g4a60ckjbukddos3jhv0,未知,2025.02.03,7,16,19,14,#黎里古镇[话题]# #留下你去过的古镇[话题]# #烟雨落江南[话题]# #江南烟雨[话题]# #古镇[话题]# #江南烟雨美如画[话题]# #古镇慢生活[话题]# #苏式建筑[话题]# #苏州古镇[话题]#	黎川水绕古城流，里巷深深岁月悠。古桥横卧映波光，镇上人家尽风流。	《黎里古镇》
方寸之间，惊鸿一瞥,https://www.xiaohongshu.com/explore/6710739e00000000240142d7?xsec_token=ABDC5RltX7oJidZLFoCAku5OLSlWHoZZJFo_Z9v2A9_SY=&xsec_source=pc_feed,5fe5f8ce0000000001001fc6,云骍随笔,https://sns-avatar-qc.xhscdn.com/avatar/637bb33e7e3c883bde22fa1c.jpg,未知,2024.10.17,907,69,3471,161,苏州市吴江区震泽古镇宝塔街上的市俭堂里的右侧仅数十平米的一小缕土地，竟也能如此蔚为大观？！	叠石起势为山，低洼处落雨为水。藤蔓缠绕，青苔密布，寥寥数支便可郁郁葱葱。不规则的地块，闪转腾挪间门洞廊桥半亭要素密布。	这弹丸之地竟然有“山”？竟然有“水”？竟然有“林”？还有亭台楼阁廊腰缦回？说实话这屁大点地方还没别处一个洗手间面积大，这手笔，惊了我。	因地制宜，方寸之间早已龙飞凤舞，于细微处做实，于方寸之间见乾坤，此乃中华根。惊鸿一瞥，这一瞥怕是要瞥到真东西了🐻	#园林[话题]# #园林景观[话题]# #园林婚纱照[话题]# #园林设计[话题]# #景观[话题]# #景观设计[话题]# #苏州园林[话题]# #苏州[话题]# #锄经园[话题]# #古典建筑[话题]#
谢谢苏州古镇让我成功戒掉了网购！,https://www.xiaohongshu.com/explore/66fa5bf0000000001a020089?xsec_token=ABu65uBfHrQi-VDPb2JWEQSFcKm0SznCnAqCIBMQRSL3k=&xsec_source=pc_feed,6576acb7000000002002d255,华佳丝绸工厂店,https://sns-avatar-qc.xhscdn.com/avatar/1040g2jo314ta0nknha005pbmliro5kil47hfac0,未知,2024.10.01,16,0,16,13,-来震泽古镇玩真的要来逛逛本地人推荐的丝绸工厂店就在盛泽！这边好多纺织厂 买丝绸的店也老多❤️这家工厂店听朋友说国内外奢牌的丝绸供应商江浙沪附近的 都是节假日开着车来买果真买丝绸就得去产地啊👍🏻居然还看到了ffq同款 真能挑到宝！选的眼花缭乱😍大人小孩 ✔️男士女士配饰 都有 ✔️地址：苏州市吴江区北环路1988号 华佳工厂店（进厂直走200米）#丝绸工厂店[话题]#  #苏州丝绸工厂店[话题]#  #真丝连衣裙[话题]#  #真丝衬衫[话题]#  #真丝家居服[话题]#  #源头工厂[话题]#  #好物分享[话题]#
真的不要特地自驾来震泽古镇,https://www.xiaohongshu.com/explore/667660e8000000001e010272?xsec_token=ABU1m9aht-DL9zrvD65Jsg3je8CUhHmtiJGN85RovtMzk=&xsec_source=pc_feed,5b37708e4eacab115b18bffc,穿西服的小女孩,https://sns-avatar-qc.xhscdn.com/avatar/6586c7fccd8c473d611ad62e.jpg,未知,2024.06.22,87,3,77,65,震泽是一个小众但宁静致远的迷你古镇，免费进入，连停车场都免费的。可以在自驾南浔古镇的路上，留一个小时来打卡震泽古镇完全绰绰有余。这两个景点之间大概11公里左右。千万不要特地自驾而来。关于景色：这里没有沸腾的商业气息，也没有接踵而至的游客，但不影响古镇散发的闲散魅力。宝塔街入口进去走到慈云禅寺，上桥后可以眺望到古镇最美的水乡精致。下桥后可以随意找一家茶馆，沿河而坐，不用特地四碗茶伺候，你也能怡然自得的享受着慢时光。关于美食：老严卤菜馆这一整墙的荣誉和拿得出的卤菜，绝对是这个镇子的重磅。黑豆干咸甜度刚好，口干扎实，还有炖的酥烂的牛腱肉片，配上苏式红汤面，望一眼窗外临河的精致，太下面（饭）了。宝塔街入口处的仁昌顺，超多点心，门面外头有刚出炉的麦芽塌饼，油墩子和各种米糕，get了让人无法理解的苏轼绿豆汤，初次尝试，不觉得有啥不适，糯米有嚼劲，绿豆颗粒感十足，冰薄荷风味恰如其分，提神醒脑，没感觉到是在喝风油精，还搭配了五仁月饼里的青红丝，这一杯把清凉解暑的气质拿捏的死死的。还是很推荐尝试的。头脑无比清醒的情况下还配了一快薄荷糕，定胜糕的化身加持淡淡的青绿色，跟古镇绝配#一张图证明你去过水乡[话题]# #苏式绿豆薄荷汤[话题]# #推荐一个好地方[话题]# #周末出游[话题]# #苏式绿豆汤透心凉[话题]#  #小众旅游[话题]# #震泽古镇[话题]# #老严卤菜馆[话题]# #仁昌顺[话题]# #江南水乡古镇游攻略[话题]#
打卡震泽 | 苏州有个“糕粽”古镇🎉地图攻略,https://www.xiaohongshu.com/explore/66625e89000000000600764a?xsec_token=ABPsIGoq1E4y8QD7uMotnwLCPu0P1GkZ28AzDhBMDbt8g=&xsec_source=pc_feed,6495c14b000000000f00696d,笃悠悠,https://sns-avatar-qc.xhscdn.com/avatar/1040g2jo313b3lgtag8005p4lo55joqbdf5vr1v8,未知,2024.06.07,162,11,123,204,考运福地“糕粽”古镇🎏除了定胜糕你还能吃点啥🍪🍵#端午旅游[话题]# 小众目的地🈶️不用人挤人🤳逛吃逛吃超自在收藏这份超详细地图攻略跟着本地人不迷路！#本地人去哪玩[话题]##苏州旅游[话题]# #端午[话题]# #小众旅行地[话题]# #旅行攻略[话题]##我的小众旅行攻略[话题]# #最美古镇攻略[话题]# #高考祈福[话题]##震泽古镇[话题]#	@户外薯 @吃货薯 @日常薯 @人文薯 @生活薯
苏州旅游之震泽古镇必吃仁昌顺！,https://www.xiaohongshu.com/explore/6777572c000000000b015eb4?xsec_token=ABANJpXGXvgpIWNobnSa9bqW2uUj26jDw32cgovd-p5So=&xsec_source=pc_feed,600abf7e0000000001004519,公主请吃饭,https://sns-avatar-qc.xhscdn.com/avatar/1040g2jo3115gqk3e6o005o0antv08h8p50hb20g,未知,2025.01.03,3,7,11,3,1️⃣定胜糕 超好吃的糕点！不会特别甜，造型也很漂亮！2️⃣油墩 香香香！香的不行！里面的肉还带点汤汁！超喜欢3️⃣萝卜丝饼 四块钱一个略贵 但是味道还是很不错的#苏州美食[话题]# #地道特色美食[话题]# #巷子里的美食[话题]# #本地人推荐美食[话题]# #地方风味美食[话题]# #走街串巷找美食[话题]# #苏州古镇[话题]# #苏州古镇美食[话题]#
,https://www.xiaohongshu.com/explore/67302767000000003c01f64c?xsec_token=ABbJEvwJ3O11l2WRyDjBpUNmXLcn9ZHV5Na9-ywoETMgs=&xsec_source=pc_feed,574bff015e87e7609f5ad415,如梦苏州,https://sns-avatar-qc.xhscdn.com/avatar/66038c0618874b056e2532ca.jpg,未知,2024.11.10,17,2,34,3,相比江南六大古镇，我更喜欢人少景美的震泽古镇。#苏州[话题]# #苏州旅游攻略[话题]# #周末去哪玩[话题]# #震泽古镇[话题]# #江南水乡美如画[话题]#
在震泽 能看到庭园的极佳状态,https://www.xiaohongshu.com/explore/6751ea0a000000000203a515?xsec_token=ABkxZOSqu8fF0IuWDuePTnD5cHo9xSbIJRK-akOdp5qWs=&xsec_source=pc_feed,618bc9280000000021026ff1,lllyz.,https://sns-avatar-qc.xhscdn.com/avatar/1040g2jo3118aiobt6e005ocbp4k8crvhjritm60,未知,2024.12.06,33,7,63,2,在师俭堂里的锄经园，因为地处震泽而远离了游客喧嚣。绿意盎然，藤蔓交错，纸墙斑驳，苔花如米。所呈现出的一方幽静天地，足够我发呆一整天。#苏州[话题]# #园林[话题]# #震泽古镇[话题]# #苏州园林[话题]# #幽静[话题]# #绿色[话题]# #江南园林[话题]# #古典园林[话题]#
周末自驾游，黎里古镇还是震泽古镇？,https://www.xiaohongshu.com/explore/6721c809000000001b02c746?xsec_token=AB64ATEDRsFOa0YFC0J_dT62wASQKxV3us-hNUkQ4HgHU=&xsec_source=pc_feed,645f50cb000000001002740f,施弘之,https://sns-avatar-qc.xhscdn.com/avatar/1040g2jo315ecdpnl0m605p2va35k4t0fdsk3ck0,未知,2024.10.30,87,67,81,35,休闲，就想走走看看，喝喝茶，聊聊天。推荐黎里古镇还是震泽古镇?#苏州[话题]# #苏州古镇[话题]# #苏州旅游[话题]# #苏州吴江[话题]# #吴江[话题]# #苏州旅游[话题]#
周末自驾游，黎里古镇还是震泽古镇？,https://www.xiaohongshu.com/explore/6721c809000000001b02c746?xsec_token=AB64ATEDRsFOa0YFC0J_dT62wASQKxV3us-hNUkQ4HgHU=&xsec_source=pc_feed,645f50cb000000001002740f,施弘之,https://sns-avatar-qc.xhscdn.com/avatar/1040g2jo315ecdpnl0m605p2va35k4t0fdsk3ck0,未知,2024.10.30,87,67,81,35,休闲，就想走走看看，喝喝茶，聊聊天。推荐黎里古镇还是震泽古镇?#苏州[话题]# #苏州古镇[话题]# #苏州旅游[话题]# #苏州吴江[话题]# #吴江[话题]# #苏州旅游[话题]#
99%的苏州人都没去过的免费景区,https://www.xiaohongshu.com/explore/66e389300000000027002e19?xsec_token=AB7GG5jpa0U7W3kXujClZ6TWQ9z83yaStEyVLJqdLKgsE=&xsec_source=pc_feed,61f5bc82000000001000b781,姑苏莫问君,https://sns-avatar-qc.xhscdn.com/avatar/1040g2jo310shu3sn6o6g5oflni141ds1bkpo8n0,未知,2024.09.13,679,93,792,156,震泽古镇，白墙黛瓦，古桥流水。漫步其间，邂逅江南旧梦，感受岁月静好。#震泽古镇[话题]# #永远被江南古镇美景折服[话题]# #人文景点分享[话题]# #人生本来就是一场修行[话题]# #爱上了这里的生活气息[话题]# #古镇[话题]# #值得N刷的宝藏出游地[话题]#
一个人的春天——春风里的震泽古镇,https://www.xiaohongshu.com/explore/6629c2b10000000004019102?xsec_token=AB1T-pOejEHpUBi4W22TgCQifNMK7FvWJAf8yOuBXBlks=&xsec_source=pc_feed,6272809c000000002102907c,燕山童姥,https://sns-avatar-qc.xhscdn.com/avatar/1040g2jo30vklv0v8ludg5ojig2e8d43sukvehd0,未知,2024.04.25,5,3,37,2,这是个并不出名的江南小镇，远不及十几公里外南浔古镇的热闹。但是在这里，你可以走，可以停，可以想，也可以不想。最重要的是，你可以不被人群和所谓的机位裹挟......#震泽古镇 #江南古镇[话题]#  #传统文化[话题]#  #古代建筑[话题]#  #慈云禅寺[话题]#  #慈云寺塔[话题]#  #震泽古镇禹迹桥[话题]#  #师俭堂[话题]#  #锄经园[话题]#
